link,name,year_of_birth,year_of_death,date_of_death,timestamp_of_death,median_views_adjusted_bd_1,median_views_adjusted_ad_1,mean_views_adjusted_bd_1,death_views_1,death_views_adjusted_1,std_1,iqr_1,median_views_adjusted_bd_2,median_views_adjusted_ad_2,mean_views_adjusted_bd_2,death_views_2,death_views_adjusted_2,std_2,iqr_2,median_views_adjusted_bd_3,median_views_adjusted_ad_3,mean_views_adjusted_bd_3,death_views_3,death_views_adjusted_3,std_3,iqr_3,median_views_adjusted_bd_7,median_views_adjusted_ad_7,mean_views_adjusted_bd_7,death_views_7,death_views_adjusted_7,std_7,iqr_7,pageid,description,canonical,display,thumbnail_source,thumbnail_width,thumbnail_height,extract_html
/wiki/Gregg_Allman,Gregg Allman,1947,2017,May 27,20170527,1350,2090,1646.4022988505747,347072,395615,1191.6862915490724,461,2751,4274,3292.8045977011493,793608,863970,2015.4285978625753,963,4232,6509.5,4939.206896551724,923881,989046,2777.8198922438332,1435,10184,15276,11529.444444444445,1088936,1150245,4872.84279382972,3574,505104,"American rock and blues singer, keyboardist, guitarist and songwriter",Gregg_Allman,Gregg Allman,https://upload.wikimedia.org/wikipedia/commons/thumb/6/6f/Gregg_Allman_1975.JPG/265px-Gregg_Allman_1975.JPG,265,320,"<p><b>Gregory LeNoir Allman</b> was an American singer-songwriter and musician. He was known for performing in the Allman Brothers Band. Allman grew up with an interest in rhythm and blues music, and the Allman Brothers Band fused it with rock music, jazz, and country at times. He wrote several of the band's biggest songs, including &quot;Whipping Post&quot;, &quot;Melissa&quot;, and &quot;Midnight Rider&quot;. Allman also had a successful solo career, releasing seven studio albums. He was born and spent much of his childhood in Nashville, Tennessee, before relocating to Daytona Beach, Florida.</p>"
/wiki/Cheick_Tiot%C3%A9,Cheick Tioté,1986,2017,June 5,20170605,206,574.5,280.5276595744681,377348,368709,327.92934222217315,117,427.5,1192.5,561.3920454545455,535389,525123,620.6698999544383,261.5,676,1791,841.5829787234043,580932,570918,869.1993653538594,373,1605.5,4316.5,1970.32,636460,629346,1603.4844612904735,719,2943775,Ivorian footballer,Cheick_Tioté,Cheick Tioté,https://upload.wikimedia.org/wikipedia/commons/thumb/9/99/Cheick_Ismael_Tiote_8920.JPG/213px-Cheick_Ismael_Tiote_8920.JPG,213,320,<p><b>Cheick Ismaël Tioté</b> was an Ivorian footballer who played as a defensive midfielder.</p>
/wiki/Adam_West,Adam West,1928,2017,June 9,20170609,2302,2710.5,2738.50634696756,2255,2383,2363.184567342343,808,4639.5,5424.5,5479.38418079096,679893,763081,3894.583672531458,1434,7021,8468.5,8219.07627118644,1124553,1226123,5053.485879722588,2081.5,16629,19175,19185.564356435643,1460083,1564737,9422.43998944908,3142,278513,American actor,Adam_West,Adam West,https://upload.wikimedia.org/wikipedia/commons/thumb/2/27/Adam_West_at_WonderCon_2009_1.JPG/239px-Adam_West_at_WonderCon_2009_1.JPG,239,320,"<p><b>William West Anderson</b>, known professionally as <b>Adam West</b>, was an American actor known primarily for his role as Batman in the 1960s ABC series of the same name and its 1966 theatrical feature film.</p>"
/wiki/Prodigy_(rapper),Prodigy (rapper),1974,2017,June 20,20170620,611,1726,656.2083333333334,255732,266416,303.2178277108175,125,1220.5,3436,1312.4166666666667,501285,516996,596.7247166826587,239,1842,5154,1968.625,580050,601782,745.8143486876163,371.5,4324,12128,4598.911764705882,731227,768516,1662.9909630526934,888,2017883,American rapper,Prodigy_(rapper),Prodigy (rapper),https://upload.wikimedia.org/wikipedia/commons/thumb/c/c6/Prodigy.jpg/239px-Prodigy.jpg,239,320,"<p><b>Albert Johnson</b>, better known by his stage name <b>Prodigy</b>, was an American rapper who was one half of the hip hop duo Mobb Deep with Havoc.</p>"
/wiki/Nelsan_Ellis,Nelsan Ellis,1977,2017,July 8,20170708,661.5,2214,713.0230352303523,235529,265278,215.66917544312128,225,1334,4480.5,1426.0460704607046,609321,662575,399.80628851759855,422,2016,6662,2139.069105691057,760665,814425,554.6513730541984,601,4659,16141,4986.504761904762,882925,942749,1111.5713470133771,1320,20128239,American film and television actor and playwright,Nelsan_Ellis,Nelsan Ellis,https://upload.wikimedia.org/wikipedia/commons/thumb/4/43/Nelsan_Ellis_at_True_Blood_premiere_party_%28crop%29.jpg/317px-Nelsan_Ellis_at_True_Blood_premiere_party_%28crop%29.jpg,317,320,"<p><b>Nelsan Ellis</b> was an American actor and playwright. He achieved critical acclaim for his portrayal of Lafayette Reynolds in the HBO television series <i>True Blood</i> (2008–2014), for which he won a Satellite Award from the International Press Academy, among other accolades. He also starred as Shinwell Johnson in <i>Elementary</i> from 2016 to 2017, and played a variety of guest roles in other television series, including <i>Veronica Mars</i> and <i>Without a Trace.</i></p>"
/wiki/Chester_Bennington,Chester Bennington,1976,2017,July 20,20170720,1606.5,8931,1850.9693333333332,2550909,2696298,1412.912707987613,499,3222,18196.5,3701.9386666666664,4862969,5184942,2630.8029646678015,1007,4848.5,26921,5552.908,5537095,5934194,3583.3490194978244,1516,11444,67508.5,12954.953271028038,6515919,6939321,6759.180237558229,3629,142809,American musician,Chester_Bennington,Chester Bennington,https://upload.wikimedia.org/wikipedia/commons/thumb/6/6d/Linkin_Park-Rock_im_Park_2014-_by_2eight_3SC0327.jpg/212px-Linkin_Park-Rock_im_Park_2014-_by_2eight_3SC0327.jpg,212,320,"<p><b>Chester Charles Bennington</b> was an American singer, songwriter, musician, and actor. He served as lead singer for the bands Linkin Park, Dead by Sunrise, Grey Daze, and Stone Temple Pilots.</p>"
/wiki/John_Heard_(actor),John Heard (actor),1946,2017,July 21,20170721,1048,2212,1303.9107856191745,892,960,927.5967150702418,447,2101,4447,2609.112,553392,615031,1716.7934197575046,846,3195.5,6414,3913.668,843434,914459,2460.6467454260883,989,7507,15238,9135.523364485982,1000474,1074979,5066.490920691964,1848,2388084,American film and television actor,John_Heard_(actor),John Heard (actor),https://upload.wikimedia.org/wikipedia/en/1/1f/John_Heard.jpg,214,317,"<p><b>John Heard Jr.</b> was an American film and television actor. He had lead roles in several films, including <i>Deceived</i>, <i>Chilly Scenes of Winter</i>, <i>Heart Beat</i>, <i>Cutter's Way</i>, <i>Cat People</i>, and <i>C.H.U.D.</i>, as well as supporting roles in <i>After Hours</i>, <i>Big</i>, <i>Beaches</i>, <i>Awakenings</i>, <i>Rambling Rose</i>, <i>The Pelican Brief</i>, <i>My Fellow Americans</i>, <i>Snake Eyes</i>, and <i>Animal Factory</i>. He also played Peter McCallister in <i>Home Alone</i> and <i>Home Alone 2: Lost in New York</i>, as well as George in <i>Sharknado</i>. Heard was nominated for an Emmy Award in 1999 for guest starring on <i>The Sopranos</i>.</p>"
/wiki/Glen_Campbell,Glen Campbell,1936,2017,August 8,20170808,3117,2373,4074.509752925878,321097,340172,4349.544117357421,1393,6315,4976.5,8118.369791666667,838722,882604,7374.015421476331,3057.5,9467,7274.5,12177.5546875,984567,1039023,9290.516667555916,4684.5,23136,17141,27517,1188205,1265242,15076.668635874548,10467,171038,"American musician, songwriter, actor",Glen_Campbell,Glen Campbell,https://upload.wikimedia.org/wikipedia/commons/thumb/2/21/Glen_Campbell_1967.JPG/259px-Glen_Campbell_1967.JPG,259,320,"<p><b>Glen Travis Campbell</b> was an American singer, guitarist, songwriter, television host, and actor. He was best known for a series of hit songs in the 1960s and 1970s, and for hosting a music and comedy variety show called <i>The Glen Campbell Goodtime Hour</i> on CBS television, from January 1969 through June 1972. He released over 70 albums in a career that spanned five decades, accumulating over 45 million record sales worldwide, including 12 gold albums, four platinum albums, and one double-platinum album.</p>"
/wiki/Bruce_Forsyth,Bruce Forsyth,1928,2017,August 18,20170818,1046,1085.5,1866.6893453145058,463804,513482,3553.572404340504,680,2152,2263,3733.753213367609,693445,778765,5783.887683557794,1411,3246,3599,5597.915057915058,788819,879302,8377.885881196085,2244,8151,8680,13061.801801801801,916868,1013360,14140.067013628566,6649,147505,"British presenter, actor, comedian, singer, dancer, and screenwriter",Bruce_Forsyth,Bruce Forsyth,https://upload.wikimedia.org/wikipedia/commons/thumb/1/11/Bruce_Forsyth1.jpg/135px-Bruce_Forsyth1.jpg,135,320,"<p><b>Sir Bruce Joseph Forsyth-Johnson</b> was a British presenter, actor, comedian, singer, dancer, and screenwriter whose career spanned more than 75 years. In 2012, <i>Guinness World Records</i> recognised Forsyth as having the longest television career for a male entertainer.Forsyth came to national attention from the mid-1950s through the ITV series <i>Sunday Night at the London Palladium</i>. He went on to host several game shows, including <i>The Generation Game</i>, <i>Play Your Cards Right</i>, <i>The Price Is Right</i> and <i>You Bet!</i>. He co-presented <i>Strictly Come Dancing</i> from 2004 to 2013.</p>"
/wiki/Jerry_Lewis,Jerry Lewis,1926,2017,August 20,20170820,3497,2619.5,4218.145966709347,702476,740509,3497.2750444733797,1195,7096.5,5277.5,8436.507692307692,1300298,1357009,6461.81999278621,2187,10635.5,8108,12654.761538461538,1465473,1531321,9242.462187187873,3234.5,24496,18331,29539.882882882885,1644144,1727545,16751.246445885397,7985,15967,"American comedian, actor, film producer, writer and film director",Jerry_Lewis,Jerry Lewis,https://upload.wikimedia.org/wikipedia/commons/thumb/1/1b/Jerry_Lewis_-_1960s.jpg/256px-Jerry_Lewis_-_1960s.jpg,256,320,"<p><b>Jerry Lewis</b> was an American comedian, actor, singer, headliner, director, screenwriter, producer and humanitarian. He was known for his slapstick humor in film, television, stage and radio and was nicknamed the &quot;King of Comedy&quot;. Lewis was one-half of the hit popular comedy duo Martin and Lewis with singer Dean Martin from 1946 to 1956.</p>"
/wiki/Harry_Dean_Stanton,Harry Dean Stanton,1926,2017,September 15,20170915,1475,2351,1673.5377942998762,78738,86724,710.3768574147986,616,2976,4767,3348.1265508684864,504158,569081,1265.4289404544675,1132,4488,7160,5020.613382899628,608740,677824,1780.7974444780518,1548,10478,16307.5,11720.695652173914,719545,788463,3511.290529938141,3066,163146,"American actor, musician, and singer",Harry_Dean_Stanton,Harry Dean Stanton,https://upload.wikimedia.org/wikipedia/commons/thumb/2/27/HarryDeanStanton-1.jpg/227px-HarryDeanStanton-1.jpg,227,320,"<p><b>Harry Dean Stanton</b> was an American actor, musician, and singer.</p>"
/wiki/Hugh_Hefner,Hugh Hefner,1926,2017,September 27,20170927,5275,4142,6978.992673992674,4983,5197,9560.572285170525,1921,10694,8505,13945.953545232274,3266479,3415717,16077.513349290668,3854,15928,12606,20936.978021978022,4080925,4333721,21824.07028241581,5416,38706,28805.5,48852.94871794872,4805007,5133598,41337.47941154533,14467,14279,American businessman and magazine publisher,Hugh_Hefner,Hugh Hefner,https://upload.wikimedia.org/wikipedia/commons/thumb/5/5c/Hugh_Hefner_Glamourcon_2010.jpg/213px-Hugh_Hefner_Glamourcon_2010.jpg,213,320,"<p><b>Hugh Marston Hefner</b> was an American businessman, magazine publisher, and playboy. He was the founder of <i>Playboy</i> and editor-in-chief of the magazine, which he founded in 1953. He was also the chief creative officer of Playboy Enterprises, which is the publishing group that operates the magazine. An advocate of sexual liberation and freedom of expression, Hefner was a political activist and philanthropist in several other causes and public issues.</p>"
/wiki/Tom_Petty,Tom Petty,1950,2017,October 2,20171002,2565.5,5735,2986.631067961165,2133306,2141858,1344.1414780142302,1244,5143,11514,5973.26213592233,4638207,4658923,2549.5577275366873,2729.5,7796.5,17520,8967.828467153284,5080095,5115319,3580.045433048758,4055,18675,38499,20944.37606837607,5670757,5742433,7688.84369033927,9014,61853,American musician,Tom_Petty,Tom Petty,https://upload.wikimedia.org/wikipedia/commons/thumb/5/5a/Tom_Petty_Live_in_Horsens_%28cropped2%29.jpg/253px-Tom_Petty_Live_in_Horsens_%28cropped2%29.jpg,253,320,"<p><b>Thomas Earl Petty</b> was an American singer-songwriter, multi-instrumentalist, record producer, and actor. He was the lead singer of Tom Petty and the Heartbreakers, formed in 1976. He previously led the band Mudcrutch. He was also a co-founder of the late 1980s supergroup the Traveling Wilburys.</p>"
/wiki/Roy_Halladay,Roy Halladay,1977,2017,November 7,20171107,456.5,1054,531.0406976744187,632434,616445,439.4852665408592,396.5,945.5,2139,1062.0813953488373,1176291,1153536,821.9865756714638,788,1421.5,3383,1591.902097902098,1299118,1277947,1104.5442265736294,1184,3521.5,8151.5,3712.4590163934427,1386710,1369225,2304.126850544977,2765,313339,baseball player from the United States,Roy_Halladay,Roy Halladay,https://upload.wikimedia.org/wikipedia/commons/thumb/1/12/Roy_Halladay_pitches_allison_full.jpg/254px-Roy_Halladay_pitches_allison_full.jpg,254,320,"<p><b>Harry Leroy Halladay III</b>, known commonly as <b>Roy Halladay</b> and often nicknamed &quot;<b>Doc</b>&quot;, was an American professional baseball player who pitched in Major League Baseball (MLB) for the Toronto Blue Jays and Philadelphia Phillies between 1998 and 2013. His nickname, coined by Toronto Blue Jays announcer Tom Cheek, was a reference to Wild West gunslinger Doc Holliday.</p>"
/wiki/Malcolm_Young,Malcolm Young,1953,2017,November 18,20171118,1543,2075.5,1798.4626865671642,546393,593455,1134.2295414689609,591,3105,4182,3593.6689655172413,816390,862500,2070.3330390821234,1211,4766.5,6333.5,5390.503448275862,931259,969584,2608.4253028087533,1894,11020,15077,12527.556451612903,1053359,1094553,5229.400185030813,3885,558139,Australian guitarist,Malcolm_Young,Malcolm Young,https://upload.wikimedia.org/wikipedia/commons/thumb/7/7a/Malcolm_Young_en_2010.jpg/320px-Malcolm_Young_en_2010.jpg,320,280,"<p><b>Malcolm Mitchell Young</b> was an Australian musician and songwriter, best known as a co-founder, rhythm guitarist, backing vocalist and songwriter for the hard rock band AC/DC. Except for a brief absence in 1988, he was with the band from its November 1973 beginning until retiring in 2014 due to health reasons. Young and the other members of AC/DC were inducted into the Rock and Roll Hall of Fame in 2003.</p>"
/wiki/Charles_Manson,Charles Manson,1934,2017,November 19,20171119,14621.5,12253,19119.441513761467,143946,143438,19649.362543498584,6609.5,29856.5,23912,38238.883027522934,1910222,1790012,32683.33273704715,12515.5,45545.5,37053,57359,2649938,2515755,46406.180357421326,20471,109584,91896,133744.58870967742,3253058,3151347,84409.17332410181,49888,42635,"American criminal, cult leader, musician",Charles_Manson,Charles Manson,https://upload.wikimedia.org/wikipedia/commons/thumb/4/4f/MansonB33920_8-14-17_%28cropped%29.jpg/288px-MansonB33920_8-14-17_%28cropped%29.jpg,288,320,"<p><b>Charles Milles Manson</b> was an American criminal, cult leader, and songwriter. In the late 1960s, he formed what became known as the Manson Family, a quasi-commune in California. Manson's followers committed a series of nine murders at four locations in July and August 1969. In 1971, he was convicted of first-degree murder and conspiracy to commit murder for the deaths of seven people, all of which members of the group carried out at his instruction. Manson was also convicted of first-degree murder for two other deaths.</p>"
/wiki/David_Cassidy,David Cassidy,1950,2017,November 21,20171121,1844.5,3134,3666.9427917620137,128388,125962,21689.72710742205,705,3800,6207,7333.885583524027,1066350,1067068,42673.533287839826,1273,5785,9370,11007.831615120274,1282414,1300065,57411.286557506624,1717,13303.5,23574,25761.645161290322,1542594,1574590,88415.28912113611,3692.5,88604,American actor and musician,David_Cassidy,David Cassidy,https://upload.wikimedia.org/wikipedia/commons/thumb/4/44/David_Cassidy_by_Allan_Warren_1974_2.jpg/226px-David_Cassidy_by_Allan_Warren_1974_2.jpg,226,320,"<p><b>David Bruce Cassidy</b> was an American actor, singer, songwriter, and guitarist. He was known for his role as Keith Partridge, the son of Shirley Partridge, in the 1970s musical-sitcom <i>The Partridge Family</i>, which led to his becoming one of popular culture's teen idols and superstar pop singers of the 1970s. He later had a career in both acting and music. He died at age 67 of liver failure that was likely caused by long-term alcohol abuse.</p>"
/wiki/Jim_Nabors,Jim Nabors,1930,2017,November 30,20171130,1821,1994,2106.9535673839187,336881,345018,1426.8964496505032,712,3684,3935,4215.764172335601,663473,695297,2358.8184277778378,1261,5614.5,6055,6323.646258503401,761796,806176,3058.13139514459,1987,13178,13732,14755.174603174602,902327,945168,5594.924114099279,4234,555824,American actor,Jim_Nabors,Jim Nabors,https://upload.wikimedia.org/wikipedia/commons/thumb/c/cf/Jim_Nabors_1968.JPG/228px-Jim_Nabors_1968.JPG,228,320,"<p><b>James Thurston Nabors</b> was an American actor, singer, and comedian.</p>"
/wiki/Shashi_Kapoor,Shashi Kapoor,1938,2017,December 4,20171204,2508,2007,2718.588500563698,630644,606888,1355.4271831074313,610,5061,4014,5439.259593679458,1207725,1163179,2227.670747596951,1050,7627,6058,8161.535593220339,1397257,1354617,3445.9923573187475,1464,17915.5,14028,19052.722222222223,1606675,1566997,6313.621371262686,2724,265130,Indian film actor and director,Shashi_Kapoor,Shashi Kapoor,,,,"<p><b>Shashi Kapoor</b> was an Indian film actor and producer. He appeared in 168 films which includes large number of Hindi films as well as in various English-language films, notably the films produced by Merchant-Ivory. He was also a film director and assistant director in the Hindi film industry.</p>"
/wiki/Kim_Jong-hyun_(singer),Kim Jong-hyun (singer),1990,2017,December 18,20171218,717,4264,766.8168701442842,604573,599926,199.87569606493042,212,1441,8527,1533.6622222222222,1018821,1034428,386.6901563490903,419,2166,12809.5,2300.4933333333333,1221928,1253882,555.7422093820919,590,5032.5,30228.5,5366.234375,1653064,1742952,1257.6895948298845,1514.5,26744321,South Korean singer and dancer,Kim_Jong-hyun_(singer),Kim Jong-hyun (singer),https://upload.wikimedia.org/wikipedia/commons/thumb/3/3f/20170708_SMTOWN_LIVE_-_%EC%A2%85%ED%98%84_%27%EB%8D%B0%EC%9E%90%EB%B6%80%27_4K_%EC%A7%81%EC%BA%A0.jpg/240px-20170708_SMTOWN_LIVE_-_%EC%A2%85%ED%98%84_%27%EB%8D%B0%EC%9E%90%EB%B6%80%27_4K_%EC%A7%81%EC%BA%A0.jpg,240,320,"<p><b>Kim Jong-hyun</b>, better known mononymously as <b>Jonghyun</b>, was a South Korean singer-songwriter, record producer, radio host, and author. He was the main vocalist of the South Korean boy band Shinee, and participated in SM Entertainment's project group SM the Ballad.</p>"
/wiki/Dolores_O%27Riordan,Dolores O'Riordan,1971,2018,January 15,20180115,1054,13148,1115.1679224973088,1012624,869167,386.3868257610935,225,2105.5,26793.5,2230.6077586206898,1922582,1693531,727.8594274629546,425.5,3158,40075,3346.304207119741,2187419,1934436,841.422819117988,664,7429,96176,7810.681818181818,2627760,2349127,1692.0365007801847,1373.5,534957,Irish singer,Dolores_O'Riordan,Dolores O'Riordan,https://upload.wikimedia.org/wikipedia/commons/thumb/b/b0/Dolores_O%27Riordan_performing_in_May_2012.jpg/234px-Dolores_O%27Riordan_performing_in_May_2012.jpg,234,320,"<p><b>Dolores Mary Eileen O'Riordan</b> was an Irish musician, singer and songwriter. She led the rock band The Cranberries from 1990 until their break-up in 2003; they reunited in 2009.</p>"
/wiki/Mark_Salling,Mark Salling,1982,2018,January 30,20180130,1038.5,2716,1604.4766949152543,436207,407714,4923.893404834091,336,2090.5,5402,3208.9533898305085,836305,788456,8167.919673603408,655.5,3153.5,8036,4817.363057324841,950362,899172,10485.65402049944,977,7510,18758,11258.10447761194,1099943,1045914,21872.081587589215,2386,24378497,American actor and musician,Mark_Salling,Mark Salling,https://upload.wikimedia.org/wikipedia/commons/thumb/c/c6/Mark_Salling_Glee_Premiere.jpg/209px-Mark_Salling_Glee_Premiere.jpg,209,320,<p><b>Mark Wayne Salling</b> was an American actor and musician. He was known for his role as Noah &quot;Puck&quot; Puckerman on the television series <i>Glee</i>.</p>
/wiki/Billy_Graham,Billy Graham,1918,2018,February 21,20180221,3000,3071,3512.4120082815734,836421,790158,2039.9668282785676,893,6095,6069.5,7024.824016563147,1362585,1295930,3805.526698022376,1583,9141,8969,10537.23602484472,1530349,1462901,5193.728545578969,2350,21388,21231,24586.884057971016,1930270,1840019,10991.129149753333,4665,690865,American Christian evangelist,Billy_Graham,Billy Graham,https://upload.wikimedia.org/wikipedia/commons/thumb/4/4f/Billy_Graham_bw_photo%2C_April_11%2C_1966_%28cropped%29.jpg/256px-Billy_Graham_bw_photo%2C_April_11%2C_1966_%28cropped%29.jpg,256,320,"<p><b>William Franklin Graham Jr.</b> was an American evangelist, a prominent evangelical Christian figure, and an ordained Southern Baptist minister who became well known internationally in the late 1940s. One of his biographers has placed him &quot;among the most influential Christian leaders&quot; of the 20th century.</p>"
/wiki/Sridevi,Sridevi,1963,2018,February 24,20180224,3826,6918,4182.721362229102,487120,497688,1585.7294684556982,973,7674.5,13940,8366.46694214876,3605175,3332170,2931.771395846242,1841.5,11596,20649,12548.164086687306,4736092,4330883,4207.611253329337,2429,27060.5,49128,29288.253623188404,6904441,6403709,8522.171618920964,4900,1938728,Indian actress,Sridevi,Sridevi,https://upload.wikimedia.org/wikipedia/commons/thumb/e/e7/Sridevi.jpg/240px-Sridevi.jpg,240,320,"<p><b>Sridevi</b> was an Indian actress and film producer who starred in Tamil, Telugu, Hindi, Malayalam, and Kannada films. She was referred to as Indian cinema's first female superstar. She was the recipient of a National Film Award, two Filmfare Awards and three Filmfare Awards South. In a career that spanned five decades, she was known for her sensitive portrayals of women thrown into challenging situations and appeared in a range of genres, from slapstick comedy to melodrama. Sridevi ranked as the highest-paid woman in the Indian entertainment industry in the 1980s and 1990s and is widely regarded as one of the greatest and most influential actresses in the history of Indian cinema.</p>"
/wiki/Davide_Astori,Davide Astori,1987,2018,March 4,20180304,125,1230,152.48413510747184,498576,463539,99.08196830032344,72,253,2355.5,304.905737704918,655457,599629,181.92846540455344,140,391,3543.5,456.95076923076925,746754,685347,260.8636378959922,197,897,8139,1064.431654676259,945590,880735,550.1097607987327,439,21296113,Italian football player,Davide_Astori,Davide Astori,https://upload.wikimedia.org/wikipedia/commons/thumb/3/35/20150616_-_Portugal_-_Italie_-_Gen%C3%A8ve_-_Davide_Astori.jpg/214px-20150616_-_Portugal_-_Italie_-_Gen%C3%A8ve_-_Davide_Astori.jpg,214,320,<p><b>Davide Astori</b> was an Italian professional footballer who played as a central defender.</p>
/wiki/Stephen_Hawking,Stephen Hawking,1942,2018,March 14,20180314,20775,19632.5,25721.830800405267,7126234,6538289,19114.485355298402,10425,42701,38546,51452.052738336715,9035384,8384560,31329.727427845588,20829,64693,59568,77165.4924012158,9676107,9033890,42961.10044856231,32044,156657,139450.5,180052.81560283687,10988417,10314830,79250.28378995683,72676,19376148,"British theoretical physicist, cosmologist, and author",Stephen_Hawking,Stephen Hawking,https://upload.wikimedia.org/wikipedia/commons/thumb/e/eb/Stephen_Hawking.StarChild.jpg/223px-Stephen_Hawking.StarChild.jpg,223,320,"<p><b>Stephen William Hawking</b> was an English theoretical physicist, cosmologist, and author, who was director of research at the Centre for Theoretical Cosmology at the University of Cambridge at the time of his death. He was the Lucasian Professor of Mathematics at the University of Cambridge between 1979 and 2009.</p>"
/wiki/R._Lee_Ermey,R. Lee Ermey,1944,2018,April 15,20180415,2200,4095.5,2442.2296368989205,239475,223123,1812.6569372048937,698,4453,8358,4885.070726915521,1419862,1299604,2664.6780899560845,1327,6784,11512.5,7328.23598820059,1616354,1487981,3351.8984886527933,1928,16180,29186,17103.31724137931,1812158,1686163,5611.170584988543,3730,262457,American actor and former United States Marine Corps drill instructor,R._Lee_Ermey,R. Lee Ermey,https://upload.wikimedia.org/wikipedia/commons/thumb/4/4f/RLeeErmeyCrop.jpeg/192px-RLeeErmeyCrop.jpeg,192,320,"<p><b>Ronald Lee Ermey</b> was an American actor and former military drill instructor. He achieved fame when he played Gunnery Sergeant Hartman in the 1987 film <i>Full Metal Jacket</i>, which earned him a Golden Globe Award nomination for Best Supporting Actor. Ermey was also a United States Marine Corps staff sergeant and an honorary gunnery sergeant. During his tenure in the United States Marine Corps, he also served as a drill instructor.</p>"
/wiki/Harry_Anderson,Harry Anderson,1952,2018,April 16,20180416,806,1655,980.3039215686274,69533,63412,806.6120272681538,428,1610.5,3393,1960.6078431372548,547266,521415,1515.4717595706404,811,2446,5015,2940.9117647058824,642909,614795,2163.0027435685615,1107,5963,11769,6879.027586206897,728744,703073,4573.455635994671,2253,1251324,American actor and magician,Harry_Anderson,Harry Anderson,https://upload.wikimedia.org/wikipedia/commons/thumb/d/dc/Harry_Anderson.jpg/240px-Harry_Anderson.jpg,240,320,"<p><b>Harry Laverne Anderson</b> was an American actor, comedian, and magician. He is best known for the lead role of Judge Harry Stone on the 1984–1992 television series <i>Night Court</i>, and later starred in the sitcom <i>Dave's World</i> from 1993 to 1997.</p>"
