link,name,year_of_birth,year_of_death,date_of_death,timestamp_of_death,median_views_adjusted_bd_1,median_views_adjusted_ad_1,mean_views_adjusted_bd_1,death_views_1,death_views_adjusted_1,std_1,iqr_1,median_views_adjusted_bd_2,median_views_adjusted_ad_2,mean_views_adjusted_bd_2,death_views_2,death_views_adjusted_2,std_2,iqr_2,median_views_adjusted_bd_3,median_views_adjusted_ad_3,mean_views_adjusted_bd_3,death_views_3,death_views_adjusted_3,std_3,iqr_3,median_views_adjusted_bd_7,median_views_adjusted_ad_7,mean_views_adjusted_bd_7,death_views_7,death_views_adjusted_7,std_7,iqr_7,pageid,description,canonical,display,thumbnail_source,thumbnail_width,thumbnail_height,extract_html
/wiki/Barbara_Bush,Barbara Bush,1925,2018,April 17,20180417,1641,2626.5,2612.963761018609,290041,278062,6474.097685998739,836,3291.5,5500,5227.6274509803925,1400934,1362681,12648.535252810872,1691,5012,7614,7841.441176470588,1649071,1615209,15475.836092953154,2708.5,11807,18038,18322.393103448278,2420415,2408726,25881.196445268386,7793,163047,Former First Lady of the United States,Barbara_Bush,Barbara Bush,https://upload.wikimedia.org/wikipedia/commons/thumb/a/a5/Barbara_Bush_portrait.jpg/244px-Barbara_Bush_portrait.jpg,244,320,"<p><b>Barbara Bush</b> was First Lady of the United States from 1989 to 1993 as the wife of George H. W. Bush, who served as the 41st President of the United States. She previously was Second Lady of the United States from 1981 to 1989. Among her six children are George W. Bush, the 43rd President of the United States, and Jeb Bush, the 43rd Governor of Florida.</p>"
/wiki/Avicii,Avicii,1989,2018,April 20,20180420,2528,18638,3180.6494140625,2879671,3012185,1972.5569133750141,1892.5,5064,38955,6361.298828125,5394655,5689889,3872.4230920782825,3830.5,7626,54479,9536.381231671554,6140944,6427636,5338.905764095134,5702,17596,131784,22235.15068493151,7139595,7389306,11191.662319353842,13298,29331348,"Swedish DJ, remixer, and record producer",Avicii,Avicii,https://upload.wikimedia.org/wikipedia/commons/thumb/9/92/Avicii_2014_003.jpg/234px-Avicii_2014_003.jpg,234,320,"<p><b>Tim Bergling</b>, better known by his stage name <b>Avicii</b>, was a Swedish musician, DJ, remixer and record producer.</p>"
/wiki/Verne_Troyer,Verne Troyer,1969,2018,April 21,20180421,1528,4671,1892.3258536585365,693807,738696,1436.1757393533696,721,3133,9215,3784.81640625,1694486,1727921,2419.231462394015,1388,4800,13531.5,5678.563049853373,2000324,2018123,3244.084271740448,1960,11697,32712.5,13252.253424657534,2266776,2277581,5899.783419302785,4374,418468,American actor,Verne_Troyer,Verne Troyer,https://upload.wikimedia.org/wikipedia/commons/thumb/6/6f/Verne_Troyer_2%2C_2012.jpg/320px-Verne_Troyer_2%2C_2012.jpg,320,319,"<p><b>Verne Jay Troyer</b> was an American actor, comedian, and stunt performer best known for playing Mini-Me in the <i>Austin Powers</i> film series. He was notable for having been only 2 ft 8 in (81 cm) tall, the result of cartilage–hair hypoplasia; this made him one of the shortest men in the world.</p>"
/wiki/TotalBiscuit,TotalBiscuit,1984,2018,May 24,20180524,804,2959,1068.6332703213611,72816,75375,1666.9615816384846,450,1630,6074,2137.2665406427222,503753,535861,3001.8216666501166,891,2479.5,9898,3209.1704545454545,591361,631752,3900.970206306466,1412.5,6062,19560,7484.324503311258,729493,768215,8726.030228972919,2958,37586959,British game critic and commentator,TotalBiscuit,TotalBiscuit,https://upload.wikimedia.org/wikipedia/commons/thumb/9/99/TB_PAX.PNG/320px-TB_PAX.PNG,320,312,"<p><b>John Peter Bain</b>, commonly known by his online aliases <b>TotalBiscuit</b>, <b>The Cynical Brit</b>, and <b>TotalHalibut</b>, was a British video gaming commentator and game critic on YouTube. He was known for his role in professional shoutcasting for games such as <i>StarCraft II</i> and <i>PlanetSide 2</i>, as well as for his regular gaming commentary videos. According to <i>Eurogamer</i>, he obtained a large following due to his video commentary on newly developed indie games and analysis of gaming news. Bain voiced strong support for consumer protection in the video gaming industry.</p>"
/wiki/Kate_Spade,Kate Spade,1962,2018,June 5,20180605,1062,11658,1362.6168224299065,2224883,2228380,1281.2476042000656,495,2117,22757,2725.233644859813,3386320,3417500,2226.0451338491425,965,3211,38110,4091.002808988764,3713703,3750404,3176.0277603103173,1526,7713.5,99952.5,9554.980263157895,4447138,4504850,7166.698535652678,3609,1979209,American fashion designer,Kate_Spade,Kate Spade,https://upload.wikimedia.org/wikipedia/en/thumb/7/76/Kate_spade.png/267px-Kate_spade.png,267,320,"<p><b>Katherine Noel Brosnahan</b>, known professionally as <b>Kate Spade</b> and <b>Kate Valentine</b>, was an American fashion designer and businesswoman. She was the founder and former co-owner of the designer brand Kate Spade New York.</p>"
/wiki/Anthony_Bourdain,Anthony Bourdain,1956,2018,June 8,20180608,4152,37729.5,5212.44734389562,4123922,4213949,3043.8211510693336,2476,8593.5,77539.5,10428.17723880597,6108854,6331998,5406.142000415919,5292,13365,111895,15644.10924369748,6786151,7014034,7225.890050871347,7806,34319,245061.5,36502.92156862745,7716101,7945307,13690.415679739044,17734,595394,American chef,Anthony_Bourdain,Anthony Bourdain,https://upload.wikimedia.org/wikipedia/commons/thumb/d/df/Anthony_bourdain_peabody_2014b.jpg/229px-Anthony_bourdain_peabody_2014b.jpg,229,320,"<p><b>Anthony Michael Bourdain</b> was an American celebrity chef, author, travel documentarian, and television personality who starred in programs focusing on the exploration of international culture, cuisine, and the human condition. He was considered one of the most influential chefs in the world.</p>"