link,name,year_of_birth,year_of_death,date_of_death,timestamp_of_death,median_views_adjusted_bd_1,median_views_adjusted_ad_1,mean_views_adjusted_bd_1,death_views_1,death_views_adjusted_1,std_1,iqr_1,median_views_adjusted_bd_2,median_views_adjusted_ad_2,mean_views_adjusted_bd_2,death_views_2,death_views_adjusted_2,std_2,iqr_2,median_views_adjusted_bd_3,median_views_adjusted_ad_3,mean_views_adjusted_bd_3,death_views_3,death_views_adjusted_3,std_3,iqr_3,median_views_adjusted_bd_7,median_views_adjusted_ad_7,mean_views_adjusted_bd_7,death_views_7,death_views_adjusted_7,std_7,iqr_7,pageid,description,canonical,display,thumbnail_source,thumbnail_width,thumbnail_height,extract_html
/wiki/Roddy_Piper,Roddy Piper,1954,2015,July 31,20150731,1804,2336,1920.4666666666667,234746,248818,406.4146268146471,569,3735,4721.5,3840.9333333333334,1228357,1351922,618.9837334068014,936,5862.5,7148,5761.4,1416289,1549371,782.902701489783,1401,13070,16725,13685.75,1828900,1975440,1342.2764944302646,1974.5,405184,Canadian professional wrestler and actor,Roddy_Piper,Roddy Piper,https://upload.wikimedia.org/wikipedia/commons/thumb/1/10/Roddy_Piper_%282014-04-04_19-10-01_NEX-6_7421_DxO_%2813933727033%29%29.jpg/180px-Roddy_Piper_%282014-04-04_19-10-01_NEX-6_7421_DxO_%2813933727033%29%29.jpg,180,320,"<p><b>Roderick George Toombs</b>, better known by his ring name &quot;<b>Rowdy</b>&quot; <b>Roddy Piper</b>, was a Canadian professional wrestler and actor.</p>"
/wiki/Wes_Craven,Wes Craven,1939,2015,August 30,20150830,1269,1481,1324.2833333333333,1283,1303,225.4730650333994,216.5,2600,2954,2648.5666666666666,636487,605209,361.74306566340084,297,3871.5,4475.5,3972.85,772369,740482,456.58978032803145,421,9125.5,10344.5,9174.375,924980,892905,568.7886113267389,715.5,153147,American director,Wes_Craven,Wes Craven,https://upload.wikimedia.org/wikipedia/commons/thumb/0/05/Wes_Craven_2010.jpg/219px-Wes_Craven_2010.jpg,219,320,"<p><b>Wesley Earl</b> &quot;<b>Wes</b>&quot; <b>Craven</b> was an American film director, writer, producer, and actor. He was known for his pioneering work in the genre of horror films, particularly slasher films, where his impact on the genre was considered prolific and influential. Due to the success and cultural impact of his works in the horror film genre, Craven has been called a &quot;Master of Horror&quot;.</p>"
/wiki/Yogi_Berra,Yogi Berra,1925,2015,September 22,20150922,1430,1134.5,1568,1196,1173,645.8017339076075,343,2903,2302,3140.829268292683,542689,537159,991.9657965788899,638,4377,3485.5,4720.7037037037035,782586,780003,1354.9110347947221,925,10409,8148,11106.90909090909,935505,940168,2349.0179168226277,4603,43088,"American baseball player, manager, coach",Yogi_Berra,Yogi Berra,https://upload.wikimedia.org/wikipedia/commons/thumb/f/f1/1953_Bowman_Yogi_Berra.jpg/212px-1953_Bowman_Yogi_Berra.jpg,212,320,"<p><b>Lawrence Peter</b> &quot;<b>Yogi</b>&quot; <b>Berra</b> was an American professional baseball catcher, who later took on the roles of manager and coach. He played 19 seasons in Major League Baseball (MLB), all but the last for the New York Yankees. He was an 18-time All-Star and won 10 World Series championships as a player—more than any other player in MLB history. Berra had a career batting average of.285, while hitting 358 home runs and 1,430 runs batted in. He is one of only five players to win the American League Most Valuable Player Award three times. He is widely regarded as one of the greatest catchers in baseball history, and was elected to the Baseball Hall of Fame in 1972.</p>"
/wiki/Maureen_O%27Hara,Maureen O'Hara,1920,2015,October 24,20151024,1792,1810,2467.5304347826086,231144,252092,2277.022798082349,897,3562,3817,4945.666666666667,487235,508265,3870.8587076387753,1639,5617.5,5917,7418.5,587825,603952,4811.484368565211,2656,14069,14252.5,17411.3125,704749,718814,11309.151193385105,4724,235309,Irish-American film actress and singer,Maureen_O'Hara,Maureen O'Hara,https://upload.wikimedia.org/wikipedia/commons/thumb/d/d6/Maureen_O%27Hara_in_The_Quiet_Man_%281952%29.png/275px-Maureen_O%27Hara_in_The_Quiet_Man_%281952%29.png,275,320,"<p><b>Maureen O'Hara</b> was an Irish-American actress and singer. O'Hara was a famous redhead who was known for playing fiercely passionate but sensible heroines, often in westerns and adventure films. On numerous occasions, she worked with director John Ford and longtime friend John Wayne. O'Hara was one of the last surviving stars from the Golden Age of Hollywood.</p>"
/wiki/Jonah_Lomu,Jonah Lomu,1975,2015,November 18,20151118,1280.5,827,2661.2642857142855,569354,555121,3629.497914136952,2366,2708,1688,5322.528571428571,698253,682871,6658.568288242125,5283,4008,2601,8074.782608695652,752854,739734,8866.301571762415,10089,8907,6230,18628.85,829712,818742,17659.253374010466,28476,264230,New Zealand rugby union player,Jonah_Lomu,Jonah Lomu,https://upload.wikimedia.org/wikipedia/commons/c/c6/Jonah_Lomu_%28cropped%29.jpg,200,300,"<p><b>Jonah Tali Lomu</b> was a New Zealand rugby union player. He became the youngest ever All Black when he played his first international in 1994 at the age of 19 years and 45 days. Playing on the wing Lomu finished his international career with 63 caps and 37 tries. He is regarded as the first true global superstar of rugby and consequently had a huge impact on the game. Lomu was inducted into the International Rugby Hall of Fame on 9 October 2007, and the IRB Hall of Fame on 24 October 2011.</p>"
/wiki/Scott_Weiland,Scott Weiland,1967,2015,December 3,20151203,1278,2312.5,1367.0064516129032,1210,1217,412.3381558831129,177,2563,4656,2735.6363636363635,879338,910573,770.0886086491556,386,3885,6958.5,4104.098039215686,1183689,1248241,1079.6973296816313,511,9171.5,16233,9574.727272727272,1681078,1725980,1793.4610060342236,1173,367133,American musician,Scott_Weiland,Scott Weiland,https://upload.wikimedia.org/wikipedia/commons/thumb/3/36/Scott_Weiland_%28Stone_Temple_Pilots%29_Open_Air_St._Gallen_%28rotated%29.jpg/233px-Scott_Weiland_%28Stone_Temple_Pilots%29_Open_Air_St._Gallen_%28rotated%29.jpg,233,320,"<p><b>Scott Richard Weiland</b> was an American musician, singer and songwriter. During a career spanning three decades, Weiland was best known as the lead singer of the band Stone Temple Pilots from 1989 to 2002 and 2008 to 2013. He was also a member of supergroup Velvet Revolver from 2003 to 2008 and recorded one album with another supergroup, Art of Anarchy. He also established himself as a solo artist, releasing three studio albums, two cover albums, and collaborations with several other musicians throughout his career.</p>"
/wiki/Natalie_Cole,Natalie Cole,1950,2015,December 31,20151231,718,1671.5,818.2732240437158,785,874,394.33038170902563,189,1433,3391,1638.0549450549452,610656,656359,681.379956656115,359,2146,5059,2454.8196721311474,1026404,1060598,980.0785433262057,491,5046.5,12175,5733.192307692308,1295377,1315383,1943.103802192429,983,423882,American singer and songwriter,Natalie_Cole,Natalie Cole,https://upload.wikimedia.org/wikipedia/commons/thumb/a/a8/Natalie_Cole_2007.jpg/247px-Natalie_Cole_2007.jpg,247,320,"<p><b>Natalie Maria Cole</b> was an American singer, voice actress, songwriter, and actress. The daughter of the great American singer Nat King Cole, she rose to musical success in the mid-1970s as an R&amp;B artist with the hits &quot;This Will Be&quot;, &quot;Inseparable&quot; (1975), and &quot;Our Love&quot; (1977). Cole re-emerged as a pop artist with the 1987 album Everlasting and her cover of Bruce Springsteen's &quot;Pink Cadillac&quot;. In the 1990s, she re-recorded standards by her father, resulting in her biggest success, <i>Unforgettable... with Love</i>, which sold over seven million copies and also won Cole seven Grammy Awards. She sold over 30 million records worldwide. On December 31, 2015, Cole died at the age of 65 at Cedars-Sinai Medical Center in Los Angeles, California, due to congestive heart failure.</p>"
/wiki/David_Bowie,David Bowie,1947,2016,January 10,20160110,9605,11311,11411.761658031088,37386,35165,8299.715854751774,2586,19407,22396,22865.322916666668,6985568,5927720,16258.490590492756,4703.5,28447.5,33702,34297.984375,9701001,8439145,22877.26303047156,7375.5,73535,78943,80329.11111111111,12006245,10673450,44916.27871474046,13394,8786,"British musician, actor, record producer and arranger",David_Bowie,David Bowie,https://upload.wikimedia.org/wikipedia/commons/thumb/e/e8/David-Bowie_Chicago_2002-08-08_photoby_Adam-Bielawski-cropped.jpg/274px-David-Bowie_Chicago_2002-08-08_photoby_Adam-Bielawski-cropped.jpg,274,320,"<p><b>David Robert Jones</b>, known professionally as <b>David Bowie</b>, was an English singer-songwriter and actor who is often considered to be one of the most influential musicians of the 20th century. He was a leading figure in popular music and was acclaimed by critics and fellow musicians for his innovative work, particularly for his work during the 1970s. His career was marked by reinvention and visual presentation, with his music and stagecraft significantly influencing popular music. During his lifetime, his record sales, estimated at 140 million albums worldwide, made him one of the world's best-selling music artists. In the UK, he was awarded ten platinum album certifications, eleven gold and eight silver, releasing eleven number-one albums. In the US, he received five platinum and nine gold certifications. He was inducted into the Rock and Roll Hall of Fame in 1996.</p>"
/wiki/Alan_Rickman,Alan Rickman,1946,2016,January 14,20160114,3817,7454,4407.776649746193,3394010,3224109,1744.6185657508004,1278,7787.5,15261,8822.19387755102,4657063,4483086,3318.2610999916237,2456,11640,23118,13241.661538461538,4988744,4824743,4837.329957343516,3897,27245.5,54328,30877.678571428572,5467390,5270517,10134.918278103012,7806,39879,"English film, television and stage actor",Alan_Rickman,Alan Rickman,https://upload.wikimedia.org/wikipedia/commons/thumb/5/50/Alan_Rickman_cropped_and_retouched.jpg/235px-Alan_Rickman_cropped_and_retouched.jpg,235,320,"<p><b>Alan Sidney Patrick Rickman</b> was an English actor and director known for playing a variety of roles on stage, television and film. Rickman trained at the Royal Academy of Dramatic Art in London and became a member of the Royal Shakespeare Company, performing in numerous theatre productions of both classical and modern. On stage, Rickman is most known for his role as Le Victomte de Valmont in the 1985 production of <i>Les Liaisons Dangereuses</i>, for which he was nominated for both a <i>Tony Award for Best Actor in a Play</i> and a <i>Drama Desk Award for Outstanding Actor in a Play</i>. Rickman was also nominated for a second Tony Award in 2002 for playing the role of Elyot Chase in Noel Coward's <i>Private Lives</i>. In 1996, Rickman gained critical recognition for his portrayal of the dark monk Grigori Rasputin in the television film <i>Rasputin: Dark Servant of Destiny</i> winning him a Golden Globe Award, a Primetime Emmy Award, a SAG Award and a Satellite Award all for best actor in a miniseries or television film. Rickman's most notable roles are through his film work. One of his most famous performances is as the Sheriff of Nottingham in the 1991 film <i>Robin Hood: Prince of Thieves</i>, which earned him a <i>BAFTA Award for Best Actor in a Supporting Role</i>. However, Rickman's most popular role is as the mysterious Professor Severus Snape in the <i>Harry Potter</i> film franchise.</p>"
/wiki/Glenn_Frey,Glenn Frey,1948,2016,January 18,20160118,1370,3167.5,1497.0995024875622,387587,353374,571.6742453841815,352,2728,6443.5,2995.89,1447036,1321297,905.5042230161051,910,4114,9585,4491.298507462687,1665432,1528383,1176.5157135908262,1143,9594,22475.5,10495,1981787,1833965,2351.9180014860817,2467.5,536880,American musician,Glenn_Frey,Glenn Frey,https://upload.wikimedia.org/wikipedia/commons/thumb/8/8a/Glenn_Frey.jpg/320px-Glenn_Frey.jpg,320,318,"<p><b>Glenn Lewis Frey</b> was an American singer, songwriter, actor and founding member of the rock band the Eagles. Frey was the lead singer and frontman for the Eagles, roles he came to share with fellow member Don Henley, with whom he wrote most of the Eagles' material. Frey played guitar and keyboards as well as singing lead vocals on songs such as &quot;Take It Easy&quot;, &quot;Peaceful Easy Feeling&quot;, &quot;Tequila Sunrise&quot;, &quot;Already Gone&quot;, &quot;James Dean&quot;, &quot;Lyin' Eyes&quot;, &quot;New Kid in Town&quot;, and &quot;Heartache Tonight&quot;.</p>"
/wiki/Terry_Wogan,Terry Wogan,1938,2016,January 31,20160131,512.5,691,764.8551401869158,474806,439574,1110.2217268428647,357,1095,1418.5,1529.7102803738317,655456,601556,1919.372785059003,795,1647,2122,2300.507042253521,702373,645209,2386.7458893001685,926,4018.5,5042,5372.666666666667,772498,713672,4257.869274127091,1917,233249,Irish radio and television broadcaster,Terry_Wogan,Terry Wogan,https://upload.wikimedia.org/wikipedia/commons/thumb/3/3b/Terry_Wogan_at_Cheltenham_Literature_Festival.jpg/222px-Terry_Wogan_at_Cheltenham_Literature_Festival.jpg,222,320,"<p><b>Sir Michael Terence Wogan</b>, better known as <b>Terry Wogan</b>, was an Irish radio and television broadcaster who worked for the BBC in the UK for most of his career. Before he retired in 2009, his BBC Radio 2 weekday breakfast programme <i>Wake Up to Wogan</i> had eight million regular listeners, making him the most listened-to radio broadcaster in Europe.</p>"
/wiki/Antonin_Scalia,Antonin Scalia,1936,2016,February 13,20160213,1331,1705,1829.6387665198238,634269,666899,2355.945889129453,682,2653,3450,3567.0530973451328,1569067,1579447,4115.344364220172,1339,4159,5186,5289.24,1928300,1909821,6072.432579760219,1874,10170,12230,12231.1875,2444531,2396812,9665.39663709378,3904,166514,former Associate Justice of the Supreme Court of the United States,Antonin_Scalia,Antonin Scalia,https://upload.wikimedia.org/wikipedia/commons/thumb/0/00/Antonin_Scalia_Official_SCOTUS_Portrait_crop.jpg/253px-Antonin_Scalia_Official_SCOTUS_Portrait_crop.jpg,253,320,"<p><b>Antonin Gregory Scalia</b> was an Associate Justice of the Supreme Court of the United States from 1986 until his death in 2016. Appointed to the Court by President Ronald Reagan in 1986, Scalia was described as the intellectual anchor for the originalist and textualist position in the Court's conservative wing.</p>"
/wiki/Nancy_Reagan,Nancy Reagan,1921,2016,March 6,20160306,3393,2200.5,3786.4738955823295,561399,542042,2164.356086552968,930,6760,4394.5,7583.75,1055017,1000193,3866.393204694325,1713,10168,6719,11359.421686746988,1206358,1147650,4567.100628131758,2640,23310,15623,26463.685714285715,1703530,1667132,8590.493838362192,7583,21181,actress and first lady of the United States,Nancy_Reagan,Nancy Reagan,https://upload.wikimedia.org/wikipedia/commons/thumb/1/18/Nancy_Reagan.jpg/256px-Nancy_Reagan.jpg,256,320,"<p><b>Nancy Davis Reagan</b> was an American film actress and the wife of Ronald Reagan, the 40th President of the United States. She served as the First Lady of the United States from 1981 to 1989.</p>"
/wiki/Johan_Cruyff,Johan Cruyff,1947,2016,March 24,20160324,1461,1780,1772.6067415730338,450986,485878,1868.6441716133027,356,2862,3611,3546.7744360902257,674566,728339,3394.1600079617997,695,4534,5410,5317.820224719101,766583,830267,3668.3047352424524,1163,10574,12640,12413.71052631579,916097,980175,8553.124193465017,2354,26276416,Dutch association football player,Johan_Cruyff,Johan Cruyff,https://upload.wikimedia.org/wikipedia/commons/thumb/b/b6/Ajax-selectie_presenteert_zich_aan_de_pers%2C_nummer_15_Heinz_Stuy%2C_nummer_16_Ruud_Krol%2C_nummer_13_Johan_Cruyff%2C_nummer_14_Wim_Suurbier_%28allen_koppen%29.jpg/240px-Ajax-selectie_presenteert_zich_aan_de_pers%2C_nummer_15_Heinz_Stuy%2C_nummer_16_Ruud_Krol%2C_nummer_13_Johan_Cruyff%2C_nummer_14_Wim_Suurbier_%28allen_koppen%29.jpg,240,320,"<p><b>Hendrik Johannes</b> &quot;<b>Johan</b>&quot; <b>Cruijff</b> <small>OON</small> was a Dutch professional football player and coach. As a player, he won the Ballon d'Or three times, in 1971, 1973, and 1974. Cruyff was the most famous exponent of the football philosophy known as Total Football explored by Rinus Michels, and is widely regarded as one of the greatest players in football history. In the late 1960s and early 1970s, Dutch football rose from obscurity to become a powerhouse in the sport. Cruyff led the Netherlands to the final of the 1974 FIFA World Cup and received the Golden Ball as player of the tournament. At the 1974 finals, he executed a feint that subsequently was named after him, the &quot;Cruyff Turn&quot;, a move widely replicated in the modern game.</p>"
/wiki/Garry_Shandling,Garry Shandling,1949,2016,March 24,20160324,553,1956.5,697.5655430711611,442476,476710,470.213871185673,273,1124,3974,1396.548872180451,1084360,1172801,843.8133498683352,494,1725,6151,2092.696629213483,1256115,1363057,1224.237303541228,693,4013.5,14496,4887.921052631579,1478661,1585816,2510.562993911703,1766,635632,American stand-up comedian,Garry_Shandling,Garry Shandling,https://upload.wikimedia.org/wikipedia/commons/thumb/2/2b/GarryShandlingApr2011.jpg/235px-GarryShandlingApr2011.jpg,235,320,"<p><b>Garry Emmanuel Shandling</b> was an American stand-up comedian, actor, director, writer, and producer. He was best known for his work in <i>It's Garry Shandling's Show</i> and <i>The Larry Sanders Show</i>.</p>"
/wiki/Patty_Duke,Patty Duke,1946,2016,March 29,20160329,1767.5,2268,1986.9007352941176,696374,686583,826.8285313736922,627,3575.5,4622,3973.801470588235,1216043,1215341,1444.9287832025664,944.5,5603,7013,5976.777777777777,1371832,1378102,1905.9369394825085,1651,13444.5,16487.5,13993.78947368421,1534595,1551871,3494.516141176319,4399,575345,American actress,Patty_Duke,Patty Duke,https://upload.wikimedia.org/wikipedia/commons/thumb/5/57/Patty_Duke_%281962%29_-_1.JPG/224px-Patty_Duke_%281962%29_-_1.JPG,224,320,"<p><b>Anna Marie</b> &quot;<b>Patty</b>&quot; <b>Duke</b> was an American actress, appearing on stage, film, and television. Her first big break came from her Academy Award winning performance at age 16 for portraying Helen Keller in <i>The Miracle Worker</i> (1962); a role which she had originated on Broadway. The following year she was given her own show, <i>The Patty Duke Show,</i> in which she played &quot;identical cousins&quot; Cathy and Patty Lane. She later progressed to more mature roles such as that of Neely O'Hara in the film <i>Valley of the Dolls</i> (1967). Over the course of her career, she received ten Emmy Award nominations and three Emmy Awards, and two Golden Globe Awards. Duke also served as president of the Screen Actors Guild from 1985 to 1988.</p>"
/wiki/Merle_Haggard,Merle Haggard,1937,2016,April 6,20160406,1520.5,1922,1676.6107142857143,451347,442205,749.3398965753057,429.5,3082,3901,3353.2214285714285,833202,826790,1277.4739251901842,787,4660,5828,5028.333333333333,938287,936681,1597.599646602482,1078,10945.5,13955,11736.275,1128348,1130747,2977.438958127437,2562,169941,"American country music song writer, singer and musician",Merle_Haggard,Merle Haggard,https://upload.wikimedia.org/wikipedia/commons/thumb/8/85/Merle_Haggard_in_1971.jpg/253px-Merle_Haggard_in_1971.jpg,253,320,"<p><b>Merle Ronald Haggard</b> was an American country singer, songwriter, guitarist, and fiddler. Along with Buck Owens, Haggard and his band the Strangers helped create the Bakersfield sound, which is characterized by the twang of Fender Telecaster and the unique mix with the traditional country steel guitar sound, new vocal harmony styles in which the words are minimal, and a rough edge not heard on the more polished Nashville sound recordings of the same era.</p>"
/wiki/Chyna,Chyna,1969,2016,April 20,20160420,4195.5,4129,4408.731292517007,3615,3628,1003.9200644590677,1064,8395,8250.5,8817.462585034014,1483927,1436483,1813.1824139581752,2238,12523,12393.5,13226.19387755102,1990678,1948763,2485.743561642719,3288,29608,29373,30861.119047619046,2469080,2436903,5067.267011123268,7288,690102,"American professional wrestler, actress, glamour model, bodybuilder, pornographic  actress",Chyna,Chyna,https://upload.wikimedia.org/wikipedia/commons/thumb/f/f1/Chyna_at_Slim-Fast_Fashion_Show_1.jpg/258px-Chyna_at_Slim-Fast_Fashion_Show_1.jpg,258,320,"<p><b>Chyna</b> was an American professional wrestler, glamour model, pornographic film actress, and bodybuilder.</p>"
/wiki/Prince_(musician),Prince (musician),1958,2016,April 21,20160421,8216,9371.5,9631.04406779661,5808147,5621947,4766.292780478814,2379,16709,19037,19261.244897959183,11273896,11147332,8019.198525266976,5277,25073,28603.5,28891.867346938776,13336871,13383196,10999.301602725025,8154,62776.5,67930,67414.35714285714,16561273,16568563,16991.142548008203,20079,57317,"American singer, songwriter, musician and actor",Prince_(musician),Prince (musician),https://upload.wikimedia.org/wikipedia/commons/thumb/e/ea/Prince.jpg/240px-Prince.jpg,240,320,"<p><b>Prince Rogers Nelson</b> was an American singer, songwriter, musician, record producer and filmmaker.</p>"
/wiki/Muhammad_Ali,Muhammad Ali,1942,2016,June 3,20160603,14971,12012,16142.689349112426,147398,158573,5155.410456165771,4596,30734,24434,32285.378698224853,4542596,4999144,8989.921665336984,8658,45998.5,37081,48511.03571428572,6348245,6842058,12071.096522218868,13228.5,110815.5,87961,113192.41666666667,8533375,9056593,21242.383515267822,26664,63747,"American boxer, philanthropist and activist",Muhammad_Ali,Muhammad Ali,https://upload.wikimedia.org/wikipedia/commons/thumb/8/89/Muhammad_Ali_NYWTS.jpg/256px-Muhammad_Ali_NYWTS.jpg,256,320,"<p><b>Muhammad Ali</b> was an American professional boxer, activist, and philanthropist. He is widely regarded as one of the most significant and celebrated sports figures of the 20th century. From early in his career, Ali was known as an inspiring, controversial, and polarizing figure both inside and outside the ring.</p>"
/wiki/Gordie_Howe,Gordie Howe,1928,2016,June 10,20160610,1068,987,1204.5565217391304,310501,336097,812.8954068374768,536,2182.5,2011,2411.5523255813955,483730,528018,1315.0826539791778,1034.5,3347,3075,3613.669565217391,548145,594269,1808.2509720084145,1451,8229,7234,8450.224489795919,715358,761902,3477.8808599684585,3411,141390,Canadian ice hockey player,Gordie_Howe,Gordie Howe,https://upload.wikimedia.org/wikipedia/commons/thumb/6/62/Gordie_Howe_Chex_card.jpg/240px-Gordie_Howe_Chex_card.jpg,240,320,"<p><b>Gordon Howe</b> was a Canadian professional ice hockey player. From 1946 to 1980, he played twenty-six seasons in the National Hockey League (NHL) and six seasons in the World Hockey Association (WHA); his first 25 seasons were spent with the Detroit Red Wings. Nicknamed &quot;Mr. Hockey&quot;, Howe is considered the most complete player to ever play the game and one of the greatest ice hockey players of all time. A 23-time NHL All-Star, he held many of the sport's career scoring records until they were broken in the 1980s by Wayne Gretzky, who himself has been a major champion of Howe's legacy. He continues to hold NHL records for most games and seasons played. In 2017, Howe was named one of the &quot;100 Greatest NHL Players&quot;.</p>"
/wiki/Christina_Grimmie,Christina Grimmie,1994,2016,June 10,20160610,1017,5181,1074.0666666666666,468,506,496.8753247135328,507,2029,10364,2148.1162790697676,1661632,1840922,893.2027025678585,1013,3218,15725,3222.2,2691249,2899898,1310.1718586240643,1429,7036,37095,7513.408163265306,3741365,3944351,2867.089350474943,3587,30963890,"American singer, songwriter, musician, actress",Christina_Grimmie,Christina Grimmie,https://upload.wikimedia.org/wikipedia/commons/thumb/9/9f/Christina_Grimmie_2014_crop.jpg/251px-Christina_Grimmie_2014_crop.jpg,251,320,"<p><b>Christina Victoria Grimmie</b> was an American singer, songwriter, musician, actress, and YouTuber known for her participation in the NBC singing competition <i>The Voice</i> and for her covers of hit songs by contemporary pop musicians. In June 2011, she released her debut EP, <i>Find Me</i>. In 2013, she released her studio album, <i>With Love</i>. In 2016, she released her second EP, <i>Side A</i>, and a posthumous release, <span><i>Side B</i></span>, was made available on iTunes and Spotify. On June 9, 2017, her second and final album, <i>All Is Vanity</i>, was released posthumously.</p>"
/wiki/Anton_Yelchin,Anton Yelchin,1989,2016,June 19,20160619,2109,6802,2222.1101694915255,668355,702516,610.8232073910926,682,4258,13796.5,4444.220338983051,1457300,1477788,1097.8160919706522,1222,6321.5,20700,6666.330508474576,1724461,1753520,1541.1130363357995,1757,14837.5,48945,15424.48,1997309,2043458,2575.3863884085436,3867,1034732,American film and television actor,Anton_Yelchin,Anton Yelchin,https://upload.wikimedia.org/wikipedia/commons/thumb/a/a7/Anton_Yelchin_Deauville_2011.jpg/226px-Anton_Yelchin_Deauville_2011.jpg,226,320,"<p><b>Anton Viktorovich Yelchin</b> was an American actor. He played Pavel Chekov in three <i>Star Trek</i> films: including the first film, <i>Star Trek</i> (2009); the first sequel, <i>Star Trek Into Darkness</i> (2013) and the posthumously released <i>Star Trek Beyond</i> (2016).</p>"
