link,name,year_of_birth,year_of_death,date_of_death,timestamp_of_death,median_views_adjusted_bd_1,median_views_adjusted_ad_1,mean_views_adjusted_bd_1,death_views_1,death_views_adjusted_1,std_1,iqr_1,median_views_adjusted_bd_2,median_views_adjusted_ad_2,mean_views_adjusted_bd_2,death_views_2,death_views_adjusted_2,std_2,iqr_2,median_views_adjusted_bd_3,median_views_adjusted_ad_3,mean_views_adjusted_bd_3,death_views_3,death_views_adjusted_3,std_3,iqr_3,median_views_adjusted_bd_7,median_views_adjusted_ad_7,mean_views_adjusted_bd_7,death_views_7,death_views_adjusted_7,std_7,iqr_7,pageid,description,canonical,display,thumbnail_source,thumbnail_width,thumbnail_height,extract_html
/wiki/Pat_Summitt,Pat Summitt,1952,2016,June 28,20160628,387,549,1138.8732782369145,408154,411994,4066.8381902264437,395,776,1159,2281.6077348066297,601625,612590,7923.227838928051,936,1199,1761,3416.619834710744,647622,660846,9974.204940875328,1374,2948,4541,8058.686274509804,701047,717585,16273.788664887457,3634,213795,basketball player and coach,Pat_Summitt,Pat Summitt,https://upload.wikimedia.org/wikipedia/commons/thumb/e/e3/Pat-Summitt-Walter-Reed-Center-06-24-08-2.jpg/167px-Pat-Summitt-Walter-Reed-Center-06-24-08-2.jpg,167,320,"<p><b>Patricia Sue Summitt</b> was an American women's college basketball head coach who accrued 1,098 career wins, the most in college basketball history upon her retirement. She served as the head coach of the University of Tennessee Lady Vols basketball team from 1974 to 2012, before retiring at age 59 because of a diagnosis of early-onset Alzheimer's disease. She won eight NCAA championships.</p>"
/wiki/Caroline_Aherne,Caroline Aherne,1963,2016,July 2,20160702,533,654,666.6948228882834,427401,478734,528.9109726113408,375,1133,1371,1335.48087431694,587805,648958,837.2121042828425,622,1707,2056.5,2003.22131147541,669683,731424,1235.7608694367477,925,4169.5,4916.5,4677.788461538462,746614,811386,2134.8202801005064,1766,514223,"English comedian, writer and actress",Caroline_Aherne,Caroline Aherne,https://upload.wikimedia.org/wikipedia/en/a/a4/Caroline_Aherne_2001.jpg,101,112,"<p><b>Caroline Mary Aherne</b> was an English comedian and BAFTA-winning writer and actress, best known for performing as the acerbic chat show host <i>Mrs Merton</i>, various roles in <i>The Fast Show</i>, and as Denise in <i>The Royle Family</i>, a series which she co-wrote.</p>"
/wiki/Juan_Gabriel,Juan Gabriel,1950,2016,August 28,20160828,537,652,688.6084905660377,259238,258389,974.0968494929344,272,1125,1296,1377.2169811320755,631975,603252,1450.6850366501671,591,1715,1931,2068.0567375886526,767549,732286,1792.7202586736337,884,4276.5,4573,4839.4,927720,895788,3105.57386645367,1923,355574,Mexican singer/Writer,Juan_Gabriel,Juan Gabriel,https://upload.wikimedia.org/wikipedia/commons/thumb/5/57/Juan_Gabriel_---_Pepsi_Center_---_09.26.14_%28cropped%29.jpg/281px-Juan_Gabriel_---_Pepsi_Center_---_09.26.14_%28cropped%29.jpg,281,320,"<p><b>Alberto Aguilera Valadez</b>, better known by his stage name <b>Juan Gabriel</b>, was a Mexican singer, songwriter and actor. Colloquially nicknamed as Juanga and El Divo de Juárez, Gabriel was known for his flamboyant style, which broke barriers within the Latin music market. Widely considered one of the best and most prolific Mexican composers and singers of all time, he has been called a pop icon.</p>"
/wiki/Gene_Wilder,Gene Wilder,1933,2016,August 29,20160829,4071,3478,5664.4094117647055,1305993,1208328,13305.2638424455,1934,8383,7130.5,11332.669811320755,2769450,2601190,19975.323475890124,4330.5,13008,11050.5,17009.673758865247,3142616,2966065,24370.109253807277,6001,32203,26169.5,39725.583333333336,3569849,3410489,35741.52302355141,14687,430144,American actor,Gene_Wilder,Gene Wilder,https://upload.wikimedia.org/wikipedia/commons/thumb/9/9e/Gene_Wilder_1970.JPG/253px-Gene_Wilder_1970.JPG,253,320,"<p><b>Jerome Silberman</b>, known professionally as <b>Gene Wilder</b>, was an American actor, screenwriter, director, producer, singer-songwriter and author.</p>"
/wiki/Alexis_Arquette,Alexis Arquette,1969,2016,September 11,20160911,1654,2096,2050.9406392694063,320739,314157,2220.5748795217555,637,3240,4260.5,4101.881278538813,939098,910543,3557.3874519964947,1278,5051,6313.5,6152.821917808219,1121787,1084524,4745.223893969935,1878,11533.5,14762.5,14388.145161290322,1321194,1285290,10119.904933645623,4245,639564,"American actress, cabaret performer and activist",Alexis_Arquette,Alexis Arquette,https://upload.wikimedia.org/wikipedia/commons/thumb/7/7f/Alexis_Arquette_2009.jpg/213px-Alexis_Arquette_2009.jpg,213,320,"<p><b>Alexis Arquette</b> was an American actress, cabaret performer, underground cartoonist, and activist. She underwent gender transitioning in her late thirties, and supported other people making similar transitions.</p>"
/wiki/Arnold_Palmer,Arnold Palmer,1929,2016,September 25,20160925,1265.5,1132,1871.4115044247787,1340,1353,2900.7321960398185,741.5,2574.5,2324,3742.8230088495575,692982,653753,5164.145431673142,1518,3912,3513,5616.473333333333,793528,753648,7444.101620922582,2104,9407,8611.5,13104.6875,917372,881482,12858.461254747543,4960,81694,American golfer,Arnold_Palmer,Arnold Palmer,https://upload.wikimedia.org/wikipedia/commons/thumb/9/9a/Arnold_Palmer_%28cropped%29.jpg/242px-Arnold_Palmer_%28cropped%29.jpg,242,320,"<p><b>Arnold Daniel Palmer</b> was an American professional golfer who is generally regarded as one of the greatest and most charismatic players in the sport's history. Dating back to 1955, he won numerous events on both the PGA Tour and the circuit now known as PGA Tour Champions. Nicknamed <b>The King</b>, he was one of golf's most popular stars and seen as a trailblazer, the first superstar of the sport's television age, which began in the 1950s.</p>"
/wiki/Bhumibol_Adulyadej,Bhumibol Adulyadej,1927,2016,October 13,20161013,1991,2050,2490.5659574468086,406780,392951,2650.133346888023,538,3978,4086,4981.131914893617,729799,721817,4291.962127745621,1087,5990,6127,7479.73717948718,872855,871854,5950.8526561133685,1577.5,14330,14324.5,17446.253731343284,1110793,1096988,9549.948885294612,3666,203756,King of Thailand,Bhumibol_Adulyadej,Bhumibol Adulyadej,https://upload.wikimedia.org/wikipedia/commons/thumb/0/0f/Anefo_911-6993_Aankomst_Koning_%28cropped%29.jpg/227px-Anefo_911-6993_Aankomst_Koning_%28cropped%29.jpg,227,320,"<p><b>Bhumibol Adulyadej</b>, conferred with the title <b>King Bhumibol the Great</b> in 1987, was the ninth monarch of Thailand from the Chakri dynasty as <b>Rama IX</b>. Reigning since 9 June 1946 he was, at the time of his death, the world's longest-reigning head of state, the longest-reigning monarch in Thai history and the longest-reigning monarch having reigned only as an adult, reigning for 70 years, 126 days. During his reign, he was served by a total of 30 prime ministers beginning with Pridi Banomyong and ending with Prayut Chan-o-cha.</p>"
/wiki/Florence_Henderson,Florence Henderson,1934,2016,November 24,20161124,970,1378,1211.51953125,968,992,1562.2552757131373,456.5,2011.5,2916,2423.0390625,536806,564957,2428.1073387463994,834.5,3006,4472,3638.4823529411765,768853,796353,3171.070122257913,1203,7198,10304.5,8485.835616438357,979232,988643,4993.598312836581,2135,3648917,American actress,Florence_Henderson,Florence Henderson,https://upload.wikimedia.org/wikipedia/commons/thumb/1/1f/Florence_Henderson_2012.jpg/227px-Florence_Henderson_2012.jpg,227,320,"<p><b>Florence Agnes Henderson</b> was an American actress and singer with a career spanning six decades. She is best remembered for her starring role as matriarch Carol Brady on the ABC sitcom <i>The Brady Bunch</i> from 1969 to 1974. Henderson also appeared in film, as well as on stage, and hosted several long-running cooking and variety shows over the years. She appeared as a guest on many scripted and unscripted television programs and as a panelist on numerous game shows. She was a contestant on <i>Dancing with the Stars</i> in 2010. Henderson hosted her own talk show, <i>The Florence Henderson Show</i>, and cooking show, <i>Who's Cooking with Florence Henderson</i>, on Retirement Living TV during the years leading up to her death at age 82 on Thanksgiving Day, 2016 from heart failure.</p>"
/wiki/Fidel_Castro,Fidel Castro,1926,2016,November 25,20161125,6354,5553,8330.662768031189,7961,8378,10329.054609028555,2033,12862.5,11166,16640.89453125,1792809,1788224,18389.2552117475,4003,19415,16658,24991.988304093567,2767667,2687687,26321.072589413474,6011,45994,39240,58227.72602739726,3981865,3797387,49443.85108307138,14688,38301,former First Secretary of the Communist Party and President of Cuba,Fidel_Castro,Fidel Castro,https://upload.wikimedia.org/wikipedia/commons/thumb/6/66/Fidel_Castro_-_MATS_Terminal_Washington_1959_%28cropped%29.png/249px-Fidel_Castro_-_MATS_Terminal_Washington_1959_%28cropped%29.png,249,320,"<p><b>Fidel Alejandro Castro Ruz</b> was a Cuban communist revolutionary and politician who governed the Republic of Cuba as Prime Minister from 1959 to 1976 and then as President from 1976 to 2008. A Marxist–Leninist and Cuban nationalist, Castro also served as the First Secretary of the Communist Party of Cuba from 1961 until 2011. Under his administration, Cuba became a one-party communist state, while industry and business were nationalized and state socialist reforms were implemented throughout society.</p>"
/wiki/John_Glenn,John Glenn,1921,2016,December 8,20161208,1970.5,3337,3101.3460076045626,508855,477120,9745.289375167573,857,4035,6728.5,6202.692015209125,1145970,1109599,14161.413520731088,1901,6185,10738,9292.965714285714,1266025,1234154,18979.189942640445,3015,15162,24970.5,21683.586666666666,1444438,1403613,32728.707471817812,6332,58702,American astronaut and politician,John_Glenn,John Glenn,https://upload.wikimedia.org/wikipedia/commons/thumb/e/e3/John_Glenn_Low_Res.jpg/252px-John_Glenn_Low_Res.jpg,252,320,"<p>Colonel <b>John Herschel Glenn Jr.</b> was a United States Marine Corps aviator, engineer, astronaut, and United States Senator from Ohio. In 1962, he became the first American to orbit the Earth, circling it three times.</p>"
/wiki/Alan_Thicke,Alan Thicke,1947,2016,December 13,20161213,1454,2777.5,1784.608286252354,3840,3676,1988.6830014062061,606,2909,5647,3569.377358490566,2055020,1974143,3207.7230425923512,1261,4537,8604,5353.824858757062,2507081,2430858,3807.537044843638,1953,10616,20455,12460.8,2838253,2774371,6273.667637567888,5338,611455,American actor,Alan_Thicke,Alan Thicke,https://upload.wikimedia.org/wikipedia/commons/thumb/d/d2/Alan_Thicke_2010.jpg/213px-Alan_Thicke_2010.jpg,213,320,"<p><b>Alan Thicke</b> was a Canadian actor, songwriter, comedian, game and talk show host. He was the father of singer Robin Thicke. In 2013, Thicke was inducted into Canada's Walk of Fame. Thicke died on December 13, 2016, in the Providence Saint Joseph Medical Center in Burbank, California, U.S.</p>"
/wiki/Zsa_Zsa_Gabor,Zsa Zsa Gabor,1917,2016,December 18,20161218,3451,2356,4168.018656716418,307928,298385,3970.232110919624,826.5,7019,4798,8336.037313432837,1749122,1622783,7137.247844730851,1963,10575.5,7211,12510.91011235955,2024567,1886544,9195.330350256438,2492,25403,17039.5,29202.263157894737,2250006,2117711,18570.201062715914,4606.5,152860,Hungarian-American socialite and actress,Zsa_Zsa_Gabor,Zsa Zsa Gabor,https://upload.wikimedia.org/wikipedia/commons/thumb/f/fc/Zsa_Zsa_Gabor_-_1959.jpg/256px-Zsa_Zsa_Gabor_-_1959.jpg,256,320,<p><b>Zsa Zsa Gabor</b> was a Hungarian-American actress and socialite. Her sisters were actresses Eva and Magda Gabor.</p>
/wiki/George_Michael,George Michael,1963,2016,December 25,20161225,3539,7590.5,3867.3370165745855,1270368,1345386,1300.1211611805563,1077,7082,15466,7739.09594095941,5546267,5480137,2460.937249459417,2254,10851,23649,11602.011049723757,6725566,6563543,3524.0894125608115,2811,25345,55520,27124.623376623378,7749130,7523825,7593.841590717315,6024,45985,"English singer-songwriter, musician, producer",George_Michael,George Michael,https://upload.wikimedia.org/wikipedia/commons/thumb/f/f2/George_Michael.jpeg/225px-George_Michael.jpeg,225,320,"<p><b>Georgios Kyriacos Panayiotou</b>, known professionally as <b>George Michael</b>, was an English singer, songwriter, record producer, and philanthropist who rose to fame as a member of the music duo Wham! He was widely known for his work in the 1980s and 1990s, including hit singles such as &quot;Wake Me Up Before You Go-Go&quot; and &quot;Last Christmas&quot;, and albums such as <i>Faith</i> (1987) and <i>Listen Without Prejudice Vol. 1</i> (1990).</p>"
/wiki/Carrie_Fisher,Carrie Fisher,1956,2016,December 27,20161227,6712,8693,17254.81100917431,3017099,2771769,47562.994716317706,6978,13572,17761,34558.205882352944,5502016,5049495,89879.31476913569,13807.5,20542,26926,51909.983425414364,7803367,7107219,122818.7854277144,19560,48109,62595,121771.1948051948,8989054,8268471,245486.36639071282,50326,314475,"American actress, screenwriter and novelist",Carrie_Fisher,Carrie Fisher,https://upload.wikimedia.org/wikipedia/commons/thumb/0/03/Carrie_Fisher_2013-a_straightened.jpg/209px-Carrie_Fisher_2013-a_straightened.jpg,209,320,"<p><b>Carrie Frances Fisher</b> was an American actress, writer, and humorist. Fisher is known for playing Princess Leia in the <i>Star Wars</i> films, a role for which she was nominated for three Saturn Awards. Her other film credits include <i>Shampoo</i> (1975), <i>The Blues Brothers</i> (1980), <i>Hannah and Her Sisters</i> (1986), <i>The 'Burbs</i> (1989), <i>When Harry Met Sally...</i> (1989), <i>Soapdish</i> (1991), and <i>The Women</i> (2008). She was nominated twice for the Primetime Emmy Award for Outstanding Guest Actress in a Comedy Series for her performances on the television series <i>30 Rock</i> and <i>Catastrophe</i>. She was posthumously made a Disney Legend in 2017, and in 2018 she was awarded a posthumous Grammy Award for Best Spoken Word Album.</p>"
/wiki/Debbie_Reynolds,Debbie Reynolds,1932,2016,December 28,20161228,2901,4035,7105.6996336996335,1065767,976904,43186.61277069262,2282,6042,8381.5,14211.399267399267,5037365,4528059,72353.6385223761,4454,9164,12631.5,21317.0989010989,5729255,5201933,97898.4844499373,6430,22373.5,30000,49739.89743589744,6283130,5741972,187328.47884730686,12513,70315,"American actress, singer, and dancer",Debbie_Reynolds,Debbie Reynolds,https://upload.wikimedia.org/wikipedia/commons/thumb/0/0f/Debbie_Reynolds_6_Allan_Warren.jpg/302px-Debbie_Reynolds_6_Allan_Warren.jpg,302,320,"<p><b>Mary Frances &quot;Debbie&quot; Reynolds</b> was an American actress, singer, businesswoman, film historian, humanitarian, and mother of the actress and writer Carrie Fisher. She was nominated for the Golden Globe Award for Most Promising Newcomer for her portrayal of Helen Kane in the 1950 film <i>Three Little Words</i>, and her breakout role was her first leading role, as Kathy Selden in <i>Singin' in the Rain</i> (1952). Other successes include <i>The Affairs of Dobie Gillis</i> (1953), <i>Susan Slept Here</i> (1954), <i>Bundle of Joy</i>, <i>The Catered Affair</i>, and <i>Tammy and the Bachelor</i> (1957), in which her performance of the song &quot;Tammy&quot; reached number one on the <i>Billboard</i> music charts. In 1959, she released her first pop music album, titled <i>Debbie</i>.</p>"
/wiki/Om_Puri,Om Puri,1950,2017,January 6,20170106,1503,1737.5,1736.9891891891891,821451,764098,1078.8547681193872,492,3011,3506,3474.696750902527,1081222,1004150,2065.5179440891006,1000,4653,5261,5210.967567567567,1191369,1099789,2555.810596337988,1422,10904,12780.5,12161.45569620253,1365620,1253089,4987.154072385178,2840,1085325,Indian actor,Om_Puri,Om Puri,https://upload.wikimedia.org/wikipedia/commons/thumb/e/ee/OmPuriSept10TIFF.jpg/206px-OmPuriSept10TIFF.jpg,206,320,"<p><b>Om Prakash Puri</b>, was an Indian actor who appeared in mainstream commercial Indian films, as well as independent and art films. He is best known for his author-backed roles in films like <i>Aakrosh</i> (1980), <i>Arohan</i> (1982), <i>Ardh Satya</i> and television films like <i>Sadgati</i> (1981) and <i>Tamas</i> (1987) and also light-hearted roles in <i>Jaane Bhi Do Yaaro</i> (1983) and <i>Chachi 420</i> (1997). He had various collaborations with director Shyam Benegal and Govind Nihalani. Puri also appeared in non-Indian productions in the United States, Britain and Pakistan.</p>"
/wiki/Miguel_Ferrer,Miguel Ferrer,1955,2017,January 19,20170119,1328.5,3860,1912.3450704225352,154786,138651,2809.6451208061967,583,2725.5,7606,3824.6901408450703,692152,632985,4342.511945353357,1002,4063,11820,5740.825396825397,804736,739965,5656.356789801621,1475,9347,27695.5,13395.25925925926,946033,861686,10537.433920274076,3195,970710,American actor,Miguel_Ferrer,Miguel Ferrer,https://upload.wikimedia.org/wikipedia/commons/thumb/7/71/Miguel_Ferrer_2015.jpg/222px-Miguel_Ferrer_2015.jpg,222,320,"<p><b>Miguel José Ferrer</b> was an American actor and voice actor. His breakthrough role was the OCP Vice President Bob Morton in the 1987 film <i>RoboCop</i>. Other film roles include Quigley in <i>Blank Check</i> (1994), Harbinger in <i>Hot Shots! Part Deux</i> (1993), Shan Yu in <i>Mulan</i> (1998), Eduardo Ruiz in <i>Traffic</i> (2000) and Vice President Rodriguez in <i>Iron Man 3</i> (2013).</p>"
/wiki/Mary_Tyler_Moore,Mary Tyler Moore,1936,2017,January 25,20170125,2456,2873,3260.3937282229967,886799,790972,4086.7541640758527,883,4971,5712.5,6520.7874564459935,1832940,1612886,6558.693651805967,1894,7638,8872,9789.151832460733,2138378,1899260,8621.25759421111,2477,17416.5,21272,22822.756097560974,2533307,2252043,17953.306653487823,5321,20833,"American actress, television producer",Mary_Tyler_Moore,Mary Tyler Moore,https://upload.wikimedia.org/wikipedia/commons/thumb/f/f5/Mary_Tyler_Moore_rework.jpg/244px-Mary_Tyler_Moore_rework.jpg,244,320,"<p><b>Mary Tyler Moore</b> was an American actress, known for her roles in the television sitcoms <i>The Mary Tyler Moore Show</i> (1970–1977), in which she starred as Mary Richards, a single woman working as a local news producer in Minneapolis, and <i>The Dick Van Dyke Show</i> (1961–1966), in which she played Laura Petrie, a former dancer turned Westchester homemaker, wife and mother. Her film work includes 1967's <i>Thoroughly Modern Millie</i> and 1980's <i>Ordinary People</i>, in which she played a role that was very different from the television characters she had portrayed, and for which she was nominated for an Academy Award for Best Actress.</p>"
/wiki/Bill_Paxton,Bill Paxton,1955,2017,February 25,20170225,2197,8375.5,2648.211570247934,3290,3211,6383.299121994667,751,4445,17161.5,5292.407284768212,2625791,2293363,9046.656497904225,1472,6672,26074.5,7935.114427860696,4101505,3499166,11039.57745206942,2162,15638.5,60284.5,18505.5,4766067,4105199,16802.56891056204,3754,303960,"American actor, director and film producer",Bill_Paxton,Bill Paxton,https://upload.wikimedia.org/wikipedia/commons/thumb/5/55/Bill_Paxton_2014.jpg/235px-Bill_Paxton_2014.jpg,235,320,"<p><b>William Archibald Paxton</b> was an American actor and director. He appeared in films such as <i>The Terminator</i> (1984), <i>Weird Science</i> (1985), <i>Aliens</i> (1986), <i>Predator 2</i> (1990), <i>Tombstone</i> (1993), <i>True Lies</i> (1994), <i>Apollo 13</i> (1995), <i>Twister</i> (1996), <i>Titanic</i> (1997), <i>U-571</i> (2000), <i>Vertical Limit</i> (2000), <i>Edge of Tomorrow</i> (2014), and <i>Nightcrawler</i> (2014). He also starred in the HBO drama series <i>Big Love</i> (2006–2011), earning three Golden Globe Award nominations during the show's run. He was nominated for a Primetime Emmy Award and a Screen Actors Guild Award for portraying Randall McCoy in the History channel miniseries <i>Hatfields &amp; McCoys</i> (2012). Paxton's final film appearance was in <i>The Circle</i> (2017), released two months after his death.</p>"
/wiki/Chuck_Berry,Chuck Berry,1926,2017,March 18,20170318,3032.5,2721,3445.758785942492,310271,298676,2315.527796283625,761,6121,5458,6891.517571884984,1223140,1130521,3632.5783721597695,1660,9285,8293,10340.298076923076,1529858,1408524,4965.225308389664,2406,21891,19237,24103.23595505618,1817917,1677330,9938.868878538175,4782,45964,American rock-and-roll musician,Chuck_Berry,Chuck Berry,https://upload.wikimedia.org/wikipedia/commons/thumb/2/20/Chuck_Berry_1957.jpg/253px-Chuck_Berry_1957.jpg,253,320,"<p><b>Charles Edward Anderson Berry</b> was an American singer, songwriter, musician, and one of the pioneers of rock and roll music. With songs such as &quot;Maybellene&quot; (1955), &quot;Roll Over Beethoven&quot; (1956), &quot;Rock and Roll Music&quot; (1957) and &quot;Johnny B. Goode&quot; (1958), Berry refined and developed rhythm and blues into the major elements that made rock and roll distinctive. Writing lyrics that focused on teen life and consumerism, and developing a music style that included guitar solos and showmanship, Berry was a major influence on subsequent rock music.</p>"
/wiki/David_Rockefeller,David Rockefeller,1915,2017,March 20,20170320,2324,1617,2753.5111464968154,425517,385680,1484.6870024010736,905,4710,3238,5507.022292993631,786639,708209,2706.0163076864133,1938,7079,4838,8263.043062200957,913183,825779,3843.447936580884,2882,16868,11677,19307.3595505618,1021122,932744,7873.101213921739,6877,659333,American banker and philanthropist,David_Rockefeller,David Rockefeller,https://upload.wikimedia.org/wikipedia/commons/thumb/4/49/David_Rockefeller_-_NARA_-_195929_%28cropped%29.jpg/241px-David_Rockefeller_-_NARA_-_195929_%28cropped%29.jpg,241,320,"<p><b>David Rockefeller</b> was an American banker who was chairman and chief executive of Chase Manhattan Corporation. He was the oldest living member of the Rockefeller family and family patriarch from August 2004 until his death in March 2017. Rockefeller was a son of John D. Rockefeller Jr. and Abby Aldrich Rockefeller, and a grandson of John D. Rockefeller and Laura Spelman Rockefeller.</p>"
/wiki/Don_Rickles,Don Rickles,1926,2017,April 6,20170406,2102,2762.5,2570.291472868217,432151,428230,2857.301365508743,684,4286,5494,5143.468944099379,811154,821435,4502.339096069074,1310,6578,8363,7710.8744186046515,932237,952155,5263.726075085179,1700,15492,19499,18002.141304347828,1133967,1150892,7942.236902324293,4315,152195,American stand-up comedian,Don_Rickles,Don Rickles,https://upload.wikimedia.org/wikipedia/commons/thumb/5/55/Don_Rickles_1973.JPG/266px-Don_Rickles_1973.JPG,266,320,"<p><b>Donald Jay Rickles</b> was an American stand-up comedian, actor and author. He became well known as an insult comic. His prominent film roles included <i>Run Silent, Run Deep</i> (1958) with Clark Gable and <i>Kelly's Heroes</i> (1970) with Clint Eastwood, and beginning in 1976 he enjoyed a two-year run starring in the NBC television sitcom <i>C.P.O. Sharkey</i>.</p>"
/wiki/Charlie_Murphy,Charlie Murphy,1959,2017,April 12,20170412,1141,3506.5,1389.4347158218127,876046,862765,1085.6650223106806,413,2313,7090,2780.353846153846,1440111,1434420,1888.755385316513,811,3513,10322,4168.304147465437,1608798,1610263,2560.22090234117,1201,8474,24802,9726.043010752688,1806472,1808736,5347.449193762435,2249,617139,American actor,Charlie_Murphy,Charlie Murphy,https://upload.wikimedia.org/wikipedia/commons/thumb/2/27/CharlieMurphyDec09.jpg/212px-CharlieMurphyDec09.jpg,212,320,"<p><b>Charles Quinton Murphy</b> was an American actor, comedian, and writer. Murphy was best known as a writer and cast member of the Comedy Central sketch-comedy series <i>Chappelle's Show</i>. He was the older brother of comedian Eddie Murphy and was the older half-brother of Vernon Lynch Jr.</p>"
/wiki/Chris_Cornell,Chris Cornell,1964,2017,May 18,20170518,2259,7494.5,2505.637554585153,2418612,2364483,941.2880802398322,736,4508,15064,5012.720116618076,3494955,3485435,1742.0131371668228,1538,6776,22874,7516.912663755458,3871342,3890496,2505.3672413852705,2292,16362,54809,17544.520408163266,4528739,4511222,5392.494162296314,4876,222165,"singer-songwriter, musician",Chris_Cornell,Chris Cornell,https://upload.wikimedia.org/wikipedia/commons/thumb/a/ab/Chris_Cornell.jpg/213px-Chris_Cornell.jpg,213,320,"<p><b>Chris Cornell</b> was an American musician, singer and songwriter. He was best known as the lead vocalist for the rock bands Soundgarden and Audioslave. Cornell was also known for his numerous solo works and soundtrack contributions since 1991, and as the founder and frontman for Temple of the Dog, the one-off tribute band dedicated to his late friend Andrew Wood.</p>"
/wiki/Roger_Moore,Roger Moore,1927,2017,May 23,20170523,3420.5,4322,4161.891618497109,1004139,944698,2302.697203642688,1739.5,7070,8734,8323.783236994219,1439949,1385061,3842.7489508497147,3401,10630,12864,12502.41304347826,1556099,1505735,5526.388155245573,5307,27016,30537.5,29222.714285714286,1796192,1764286,10591.274747428195,8365,174716,British actor,Roger_Moore,Roger Moore,https://upload.wikimedia.org/wikipedia/commons/thumb/7/7d/Sir_Roger_Moore_3.jpg/234px-Sir_Roger_Moore_3.jpg,234,320,<p><b>Sir Roger George Moore</b> was an English actor. He is best known for having played Ian Fleming's fictional British secret agent James Bond in seven feature films from 1973 to 1985.</p>
